{
  "schema_version": "1.0.0",
  "updated_at": "2026-08-08",
  "methodology": {
    "scope": "Traditional Mongolian script digitization, Web layout, Unicode encoding and shaping, OCR, language resources, NLP and AI evaluation. Cyrillic-only work is included only when it provides an explicit bridge to Traditional Mongolian.",
    "evidence_policy": [
      "Tier A sources are standards bodies, official institution pages and peer-reviewed proceedings.",
      "Tier B sources are clearly labelled preprints or original public code/data repositories.",
      "Search snippets, marketing summaries, secondary blogs and unverified contact details are not accepted as standalone evidence.",
      "A record describes only what its cited source establishes; absence from this dataset is never evidence that an institution or researcher does not exist.",
      "Traditional Mongolian, Cyrillic Mongolian and mixed-script work are tagged separately."
    ],
    "verification_states": ["verified", "provisional", "rejected"],
    "script_scopes": ["traditional", "cyrillic", "mixed", "unspecified"]
  },
  "sources": [
    {
      "id": "src-unicode17",
      "title": "Unicode 17.0 Core Specification, Chapter 13.5 Mongolian",
      "publisher": "Unicode Consortium",
      "url": "https://www.unicode.org/versions/Unicode17.0.0/core-spec/chapter-13/",
      "source_type": "standard_body",
      "accessed_at": "2026-08-08",
      "tier": "A",
      "note": "Normative Unicode character model context; points implementers to UTN #57."
    },
    {
      "id": "src-unicode-tn57",
      "title": "Unicode Technical Note #57: Encoding and Shaping of the Mongolian Script, Version 4",
      "publisher": "Unicode Consortium / Kushim Jiang",
      "url": "https://www.unicode.org/notes/tn57/",
      "source_type": "standard_body",
      "accessed_at": "2026-08-08",
      "tier": "A",
      "note": "Technical note, not a normative Unicode Standard endorsement."
    },
    {
      "id": "src-unicode-doclist",
      "title": "Unicode Mongolian Document List",
      "publisher": "Unicode Consortium",
      "url": "https://www.unicode.org/L2/topical/mongolian/",
      "source_type": "standard_body",
      "accessed_at": "2026-08-08",
      "tier": "A",
      "note": "Primary registry of Mongolian encoding proposals, meeting documents and reports."
    },
    {
      "id": "src-w3c-mlreq",
      "title": "Mongolian Layout Requirements",
      "publisher": "W3C Internationalization Working Group",
      "url": "https://www.w3.org/International/mlreq/",
      "source_type": "standard_body",
      "accessed_at": "2026-08-08",
      "tier": "A",
      "note": "Editor draft targeting a W3C Working Group Note; documents vertical left-to-right layout and NNBSP behavior."
    },
    {
      "id": "src-w3c-charter",
      "title": "Mongolian Layout Task Force Charter",
      "publisher": "W3C",
      "url": "https://www.w3.org/International/mlreq/charter/",
      "source_type": "standard_body",
      "accessed_at": "2026-08-08",
      "tier": "A",
      "note": "Defines the task force mission, chairs, contacts and public process."
    },
    {
      "id": "src-noto",
      "title": "Noto Mongolian source repository",
      "publisher": "Noto Fonts",
      "url": "https://github.com/notofonts/mongolian",
      "source_type": "official_repository",
      "accessed_at": "2026-08-08",
      "tier": "B",
      "note": "Original font sources, releases, OFL license and automated QA workflow."
    },
    {
      "id": "src-imu-lab",
      "title": "内蒙古自治区多语种人工智能技术重点实验室",
      "publisher": "内蒙古大学计算机学院",
      "url": "https://ccs.imu.edu.cn/info/1041/1770.htm",
      "source_type": "official_institution",
      "accessed_at": "2026-08-08",
      "tier": "A",
      "note": "Official laboratory profile covering OCR, ASR/TTS, translation, conversion, input methods and AI systems."
    },
    {
      "id": "src-imu-tmbench",
      "title": "飞龙、王炜华课题组2篇论文被SIGIR 2026录用",
      "publisher": "内蒙古大学",
      "url": "https://www.imu.edu.cn/info/1375/14064.htm",
      "source_type": "official_institution",
      "accessed_at": "2026-08-08",
      "tier": "A",
      "note": "Official acceptance announcement and factual summary of TM-Bench."
    },
    {
      "id": "src-imu-si",
      "title": "斯·劳格劳教师主页",
      "publisher": "内蒙古大学蒙古学学院",
      "url": "https://mgx.imu.edu.cn/info/1321/3030.htm",
      "source_type": "official_institution",
      "accessed_at": "2026-08-08",
      "tier": "A",
      "note": "Official research, standards and publication profile."
    },
    {
      "id": "src-imu-micro",
      "title": "蒙古语言文学数智化处理微专业招生与遴选办法",
      "publisher": "内蒙古大学蒙古学学院",
      "url": "https://mgx.imu.edu.cn/info/1065/3965.htm",
      "source_type": "official_institution",
      "accessed_at": "2026-08-08",
      "tier": "A",
      "note": "2026 cross-disciplinary curriculum connecting Mongolian studies, AI, data and cultural digitization."
    },
    {
      "id": "src-imu-wang",
      "title": "王炜华教师主页",
      "publisher": "内蒙古大学计算机学院",
      "url": "https://ccs.imu.edu.cn/info/1021/2685.htm",
      "source_type": "official_institution",
      "accessed_at": "2026-08-08",
      "tier": "A"
    },
    {
      "id": "src-imnu-team",
      "title": "蒙古文信息处理与机器翻译创新团队",
      "publisher": "内蒙古师范大学计算机科学技术学院",
      "url": "https://cs.imnu.edu.cn/info/1053/1291.htm",
      "source_type": "official_institution",
      "accessed_at": "2026-08-08",
      "tier": "A"
    },
    {
      "id": "src-imnu-bai",
      "title": "白双成教师主页",
      "publisher": "内蒙古师范大学人工智能学院",
      "url": "https://sai.imnu.edu.cn/info/1081/1151.htm",
      "source_type": "official_institution",
      "accessed_at": "2026-08-08",
      "tier": "A"
    },
    {
      "id": "src-muc-lab",
      "title": "民族语言多模态信息处理应用研究",
      "publisher": "中央民族大学民族语言智能分析与安全治理教育部重点实验室",
      "url": "https://mzyy.muc.edu.cn/info/1078/1133.htm",
      "source_type": "official_institution",
      "accessed_at": "2026-08-08",
      "tier": "A"
    },
    {
      "id": "src-muc-base",
      "title": "蒙古文大数据研究基地（内蒙古师范大学）",
      "publisher": "国家语言资源监测与研究民族语言中心",
      "url": "https://nmlr.muc.edu.cn/info/1096/1108.htm",
      "source_type": "official_institution",
      "accessed_at": "2026-08-08",
      "tier": "A"
    },
    {
      "id": "src-num-ocr",
      "title": "Deep Learning Optimization for Printed Mongolian Script Text Recognition",
      "publisher": "National University of Mongolia",
      "url": "https://portal.num.edu.mn/Staff/bb97c007-e2af-491f-97bc-42b9dba83944/Publications",
      "source_type": "official_institution",
      "accessed_at": "2026-08-08",
      "tier": "A",
      "note": "Official university publication profile reporting the 2025 printed-script OCR study."
    },
    {
      "id": "src-acl-ner2016",
      "title": "Mongolian Named Entity Recognition System with Rich Features",
      "publisher": "ACL Anthology / COLING 2016",
      "url": "https://aclanthology.org/C16-1049/",
      "source_type": "peer_reviewed",
      "accessed_at": "2026-08-08",
      "tier": "A"
    },
    {
      "id": "src-acl-ner2018",
      "title": "Attention-based BLSTM-CRF Architecture for Mongolian Named Entity Recognition",
      "publisher": "ACL Anthology / PACLIC 2018",
      "url": "https://aclanthology.org/Y18-1088/",
      "source_type": "peer_reviewed",
      "accessed_at": "2026-08-08",
      "tier": "A"
    },
    {
      "id": "src-acl-mc2",
      "title": "MC²: Towards Transparent and Culturally-Aware NLP for Minority Languages in China",
      "publisher": "ACL Anthology / ACL 2024",
      "url": "https://aclanthology.org/2024.acl-long.479/",
      "source_type": "peer_reviewed",
      "accessed_at": "2026-08-08",
      "tier": "A"
    },
    {
      "id": "src-acl-lotus",
      "title": "Can Large Language Models Translate Unseen Languages in Underrepresented Scripts?",
      "publisher": "ACL Anthology / EMNLP 2025",
      "url": "https://aclanthology.org/2025.emnlp-main.1179/",
      "source_type": "peer_reviewed",
      "accessed_at": "2026-08-08",
      "tier": "A"
    },
    {
      "id": "src-acl-cmhg",
      "title": "CMHG: A Dataset and Benchmark for Headline Generation of Minority Languages in China",
      "publisher": "ACL Anthology / EMNLP 2025",
      "url": "https://aclanthology.org/2025.emnlp-main.622/",
      "source_type": "peer_reviewed",
      "accessed_at": "2026-08-08",
      "tier": "A"
    },
    {
      "id": "src-acl-monculture",
      "title": "MonCulture-Eval: A Hierarchical Benchmark for Evaluating Mongolian Cultural Capabilities of Large Language Models across Scripts and Regions",
      "publisher": "ACL Anthology / Findings of ACL 2026",
      "url": "https://aclanthology.org/2026.findings-acl.1449/",
      "source_type": "peer_reviewed",
      "accessed_at": "2026-08-08",
      "tier": "A"
    },
    {
      "id": "src-arxiv-mmeval",
      "title": "MM-Eval: A Hierarchical Benchmark for Modern Mongolian Evaluation in LLMs",
      "publisher": "arXiv",
      "url": "https://arxiv.org/abs/2411.09492",
      "source_type": "preprint",
      "accessed_at": "2026-08-08",
      "tier": "B",
      "note": "Preprint; retained separately from peer-reviewed evidence."
    },
    {
      "id": "src-arxiv-milic",
      "title": "MiLiC-Eval: Benchmarking Multilingual LLMs for China's Minority Languages",
      "publisher": "arXiv",
      "url": "https://arxiv.org/abs/2503.01150",
      "source_type": "preprint",
      "accessed_at": "2026-08-08",
      "tier": "B"
    },
    {
      "id": "src-arxiv-copit",
      "title": "CoPiT: Cognitive Pivot Translation for Digraphic Low-Resource Mongolian in the Traditional Script",
      "publisher": "arXiv",
      "url": "https://arxiv.org/abs/2607.05849",
      "source_type": "preprint",
      "accessed_at": "2026-08-08",
      "tier": "B"
    },
    {
      "id": "src-tugstugi",
      "title": "tugstugi/mongolian-nlp resource catalog",